"Mitigation Name","data source","technique","Software Name","Software Description","Mitigation Description","Application","TID","Use","tactic"
"Code Signing","binary file metadata","masquerading","Catchamas","[Catchamas](https://attack.mitre.org/software/S0261) is a Windows Trojan that steals information from compromised systems. (Citation: Symantec Catchamas April 2018)","Enforce binary and application integrity with digital signature verification to prevent untrusted code from executing.","Require signed binaries.","T1036","[Catchamas](https://attack.mitre.org/software/S0261) adds a new service named NetAdapter in an apparent attempt to masquerade as a legitimate service.","defense-evasion"
"Execution Prevention","binary file metadata","masquerading","Catchamas","[Catchamas](https://attack.mitre.org/software/S0261) is a Windows Trojan that steals information from compromised systems. (Citation: Symantec Catchamas April 2018)","Block execution of code on a system through application whitelisting, blacklisting, and/or script blocking.","Use tools that restrict program execution via whitelisting by attributes other than file name for common operating system utilities that are needed.","T1036","[Catchamas](https://attack.mitre.org/software/S0261) adds a new service named NetAdapter in an apparent attempt to masquerade as a legitimate service.","defense-evasion"
"Restrict File and Directory Permissions","binary file metadata","masquerading","Catchamas","[Catchamas](https://attack.mitre.org/software/S0261) is a Windows Trojan that steals information from compromised systems. (Citation: Symantec Catchamas April 2018)","Restrict access by setting directory and file permissions that are not specific to users or privileged accounts.","Use file system access controls to protect folders such as C:\\Windows\\System32.","T1036","[Catchamas](https://attack.mitre.org/software/S0261) adds a new service named NetAdapter in an apparent attempt to masquerade as a legitimate service.","defense-evasion"
"Restrict Registry Permissions","windows event logs","modify registry","Catchamas","[Catchamas](https://attack.mitre.org/software/S0261) is a Windows Trojan that steals information from compromised systems. (Citation: Symantec Catchamas April 2018)","Restrict the ability to modify certain hives or keys in the Windows Registry.","Ensure proper permissions are set for Registry hives to prevent users from modifying keys for system components that may lead to privilege escalation.","T1112","[Catchamas](https://attack.mitre.org/software/S0261) creates three Registry keys to establish persistence by adding a [New Service](https://attack.mitre.org/techniques/T1050).","defense-evasion"
"User Account Management","windows event logs","new service","Catchamas","[Catchamas](https://attack.mitre.org/software/S0261) is a Windows Trojan that steals information from compromised systems. (Citation: Symantec Catchamas April 2018)","Manage the creation, modification, use, and permissions associated to user accounts.","Limit privileges of user accounts and remediate Privilege Escalation vectors so only  authorized administrators can create new services.","T1050","[Catchamas](https://attack.mitre.org/software/S0261) adds a new service named NetAdapter to establish persistence.","persistence"
"User Account Management","windows event logs","new service","Catchamas","[Catchamas](https://attack.mitre.org/software/S0261) is a Windows Trojan that steals information from compromised systems. (Citation: Symantec Catchamas April 2018)","Manage the creation, modification, use, and permissions associated to user accounts.","Limit privileges of user accounts and remediate Privilege Escalation vectors so only  authorized administrators can create new services.","T1050","[Catchamas](https://attack.mitre.org/software/S0261) adds a new service named NetAdapter to establish persistence.","privilege-escalation"
